{
  "body": "opto-sync sync cycle completed",
  "severityText": "INFO",
  "severityNumber": 9,
  "timestamp": "2026-08-11T17:53:28.151Z",
  "attributes": {
    "service.name": "opto-sync",
    "event.name": "opto.sync.cycle.completed",
    "opto.sync.schema": "opto-sync.telemetry/v1",
    "opto.sync.runtime": "typescript",
    "opto.sync.status": "idle",
    "opto.sync.consecutive_failures": 0,
    "opto.sync.pushed_mutations": 3,
    "opto.sync.acknowledged_mutations": 3,
    "opto.sync.pulled_changes": 2,
    "opto.sync.installed_snapshots": 0,
    "opto.sync.has_more_pending": false,
    "request.id": "sync-cycle-42"
  },
  "traceId": "0123456789abcdef0123456789abcdef",
  "spanId": "0123456789abcdef",
  "traceFlags": 1
}
